URL,Version,Status,OIDs,Name,Title,Description,Used
http://dicom.nema.org/resources/ontology/DCM,01,active,"1.2.840.10008.2.16.4",DICOM Controlled Terminology Definitions,,"DICOM Code Definitions (Coding Scheme Designator ""DCM"" Coding Scheme Version ""01"")","ValueSet/participation-role-type,ValueSet/dicm-405-mediatype,ValueSet/audit-event-sub-type,ValueSet/security-role-type,ValueSet/audit-event-type"
http://hl7.org/fhir/CodeSystem/medication-status,4.0.1,draft,"2.16.840.1.113883.4.642.4.1380",Medication Status Codes,Medication  status  codes,"Medication Status Codes","ValueSet/medication-status"
http://hl7.org/fhir/CodeSystem/medicationrequest-intent,4.0.1,draft,"2.16.840.1.113883.4.642.4.1378",medicationRequest Intent,Medication request  intent,"MedicationRequest Intent Codes","ValueSet/medicationrequest-intent"
http://hl7.org/fhir/CodeSystem/medicationrequest-status,4.0.1,draft,"2.16.840.1.113883.4.642.4.1377",medicationrequest Status,Medicationrequest  status,"MedicationRequest Status Codes","ValueSet/medicationrequest-status"
http://hl7.org/fhir/CodeSystem/task-code,4.0.1,active,"2.16.840.1.113883.4.642.4.1397",TaskCode,Task Codes,"Codes indicating the type of action that is expected to be performed","ValueSet/task-code"
http://hl7.org/fhir/address-type,4.0.1,active,"2.16.840.1.113883.4.642.4.70",AddressType,AddressType,"The type of an address (physical / postal).","ValueSet/address-type"
http://hl7.org/fhir/address-use,4.0.1,active,"2.16.840.1.113883.4.642.4.68",AddressUse,AddressUse,"The use of an address.","ValueSet/address-use"
http://hl7.org/fhir/administrative-gender,4.0.1,active,"2.16.840.1.113883.4.642.4.2",AdministrativeGender,AdministrativeGender,"The gender of a person used for administrative purposes.","ValueSet/administrative-gender"
http://hl7.org/fhir/audit-event-action,4.0.1,draft,"2.16.840.1.113883.4.642.4.453",AuditEventAction,AuditEventAction,"Indicator for type of action performed during the event that generated the event.","ValueSet/audit-event-action"
http://hl7.org/fhir/audit-event-outcome,4.0.1,draft,"2.16.840.1.113883.4.642.4.455",AuditEventOutcome,AuditEventOutcome,"Indicates whether the event succeeded or failed.","ValueSet/audit-event-outcome"
http://hl7.org/fhir/bundle-type,4.0.1,active,"2.16.840.1.113883.4.642.4.621",BundleType,BundleType,"Indicates the purpose of a bundle - how it is intended to be used.","ValueSet/bundle-type"
http://hl7.org/fhir/composition-status,4.0.1,draft,"2.16.840.1.113883.4.642.4.242",CompositionStatus,CompositionStatus,"The workflow/clinical status of the composition.","ValueSet/composition-status"
http://hl7.org/fhir/contact-point-system,4.0.1,active,"2.16.840.1.113883.4.642.4.72",ContactPointSystem,ContactPointSystem,"Telecommunications form for contact point.","ValueSet/contact-point-system"
http://hl7.org/fhir/contact-point-use,4.0.1,active,"2.16.840.1.113883.4.642.4.74",ContactPointUse,ContactPointUse,"Use of contact point.","ValueSet/contact-point-use"
http://hl7.org/fhir/days-of-week,4.0.1,active,"2.16.840.1.113883.4.642.4.513",DaysOfWeek,DaysOfWeek,"The days of the week.","ValueSet/days-of-week"
http://hl7.org/fhir/document-reference-status,4.0.1,draft,"2.16.840.1.113883.4.642.4.8",DocumentReferenceStatus,DocumentReferenceStatus,"The status of the document reference.","ValueSet/document-reference-status"
http://hl7.org/fhir/document-relationship-type,4.0.1,draft,"2.16.840.1.113883.4.642.4.245",DocumentRelationshipType,DocumentRelationshipType,"The type of relationship between documents.","ValueSet/document-relationship-type"
http://hl7.org/fhir/eligibilityrequest-purpose,4.0.1,draft,"2.16.840.1.113883.4.642.4.1183",EligibilityRequestPurpose,EligibilityRequestPurpose,"A code specifying the types of information being requested.","ValueSet/eligibilityrequest-purpose"
http://hl7.org/fhir/encounter-location-status,4.0.1,draft,"2.16.840.1.113883.4.642.4.263",EncounterLocationStatus,EncounterLocationStatus,"The status of the location.","ValueSet/encounter-location-status"
http://hl7.org/fhir/encounter-status,4.0.1,draft,"2.16.840.1.113883.4.642.4.247",EncounterStatus,EncounterStatus,"Current state of the encounter.","ValueSet/encounter-status"
http://hl7.org/fhir/event-status,4.0.1,draft,"2.16.840.1.113883.4.642.4.110",EventStatus,EventStatus,"Codes identifying the lifecycle stage of an event.","ValueSet/event-status"
http://hl7.org/fhir/fm-status,4.0.1,draft,"2.16.840.1.113883.4.642.4.593",FinancialResourceStatusCodes,Financial Resource Status Codes,"This value set includes Status codes.","ValueSet/fm-status"
http://hl7.org/fhir/http-verb,4.0.1,active,"2.16.840.1.113883.4.642.4.625",HTTPVerb,HTTPVerb,"HTTP verbs (in the HTTP command line). See [HTTP rfc](https://tools.ietf.org/html/rfc7231) for details.","ValueSet/http-verb"
http://hl7.org/fhir/identifier-use,4.0.1,active,"2.16.840.1.113883.4.642.4.58",IdentifierUse,IdentifierUse,"Identifies the purpose for this identifier, if known .","ValueSet/identifier-use"
http://hl7.org/fhir/link-type,4.0.1,active,"2.16.840.1.113883.4.642.4.424",LinkType,LinkType,"The type of link between this patient resource and another patient resource.","ValueSet/link-type"
http://hl7.org/fhir/location-mode,4.0.1,draft,"2.16.840.1.113883.4.642.4.331",LocationMode,LocationMode,"Indicates whether a resource instance represents a specific location or a class of locations.","ValueSet/location-mode"
http://hl7.org/fhir/location-status,4.0.1,draft,"2.16.840.1.113883.4.642.4.333",LocationStatus,LocationStatus,"Indicates whether the location is still in use.","ValueSet/location-status"
http://hl7.org/fhir/name-use,4.0.1,active,"2.16.840.1.113883.4.642.4.66",NameUse,NameUse,"The use of a human name.","ValueSet/name-use"
http://hl7.org/fhir/network-type,4.0.1,draft,"2.16.840.1.113883.4.642.4.457",AuditEventAgentNetworkType,AuditEventAgentNetworkType,"The type of network access point of this agent in the audit event.","ValueSet/network-type"
http://hl7.org/fhir/provenance-entity-role,4.0.1,draft,"2.16.840.1.113883.4.642.4.437",ProvenanceEntityRole,ProvenanceEntityRole,"How an entity was used in an activity.","ValueSet/provenance-entity-role"
http://hl7.org/fhir/request-intent,4.0.1,draft,"2.16.840.1.113883.4.642.4.114",RequestIntent,RequestIntent,"Codes indicating the degree of authority/intentionality associated with a request.","ValueSet/task-intent"
http://hl7.org/fhir/request-priority,4.0.1,draft,"2.16.840.1.113883.4.642.4.116",RequestPriority,RequestPriority,"Identifies the level of importance to be assigned to actioning the request.","ValueSet/request-priority"
http://hl7.org/fhir/resource-types,4.0.1,active,,ResourceType,ResourceType,"One of the resource types defined as part of this version of FHIR.","ValueSet/audit-entity-type"
http://hl7.org/fhir/restful-interaction,4.0.1,active,,FHIR Restful Interactions,,"The set of interactions defined by the RESTful part of the FHIR specification.","ValueSet/audit-event-sub-type"
http://hl7.org/fhir/search-entry-mode,4.0.1,active,"2.16.840.1.113883.4.642.4.623",SearchEntryMode,SearchEntryMode,"Why an entry is in the result set - whether it's included as a match or because of an _include requirement, or to convey information or warning information about the search process.","ValueSet/search-entry-mode"
http://hl7.org/fhir/sid/icd-10,2.1.1,retired,"2.16.840.1.113883.6.3",Icd10,ICD-10,"International Classification of Diseases revision 10 (ICD 10)","ValueSet/icd-10"
http://hl7.org/fhir/task-intent,4.0.1,draft,"2.16.840.1.113883.4.642.4.1241",TaskIntent,TaskIntent,"Distinguishes whether the task is a proposal, plan or full order.","ValueSet/task-intent"
http://hl7.org/fhir/task-status,4.0.1,draft,"2.16.840.1.113883.4.642.4.791",TaskStatus,TaskStatus,"The current status of the task.","ValueSet/task-status"
http://loinc.org,3.1.0,active,"2.16.840.1.113883.6.1",LOINC,Logical Observation Identifiers, Names and Codes (LOINC),"LOINC provides a set of universal names and ID codes for identifying laboratory and clinical test results.1,2 LOINC facilitates the exchange and pooling of results, such as blood hemoglobin, serum potassium, or vital signs, for clinical care, outcomes management, and research. LOINC's universal identifiers (names and codes) can be used in the context of order and observation exchanges between information systems that use syntax standards such as HL73, CEN TC251, ISO TC215, ASTM4, and DICOM. Specifically, the identifier can be used as the coded value for an observation in any other standard that uses the observation/observation value paradigm, whether messages, documents, application programming interface (API), etc. For example, LOINC codes are used widely in the OBX segment Observation Identifier field (OBX-3) of an ORU HL7 (HL7 version 2.x or ASTM 1238-9410) message that may be sent between a Clinical Laboratory Information Management Systems (LIMS) and Electronic Health Record Systems (EHR).5, 6 In this way, LOINC codes provide universal identifiers that allow the exchange of clinical data between heterogeneous computing environments.","ValueSet/c80-doc-typecodes,ValueSet/document-classcodes"
http://snomed.info/sct,null,active,"2.16.840.1.113883.6.96",SNOMED_CT,SNOMED CT (all versions),"SNOMED CT is the most comprehensive and precise clinical health terminology product in the world, owned and distributed around the world by The International Health Terminology Standards Development Organisation (IHTSDO).","ValueSet/performer-role,ValueSet/c80-facilitycodes,ValueSet/clinical-findings,ValueSet/condition-stage,ValueSet/encounter-reason,ValueSet/c80-practice-codes,ValueSet/additional-instruction-codes,ValueSet/route-codes,ValueSet/approach-site-codes,ValueSet/condition-code,ValueSet/practitioner-role,ValueSet/condition-stage-type,ValueSet/medication-form-codes,ValueSet/medication-codes,ValueSet/body-site,ValueSet/manifestation-or-symptom,ValueSet/administration-method-codes,ValueSet/medication-as-needed-reason,ValueSet/condition-severity"
http://terminology.hl7.org/CodeSystem/admit-source,1.0.1,active,"2.16.840.1.113883.4.642.1.1092",AdmitSource,Admit source,"This value set defines a set of codes that can be used to indicate from where the patient came in.","ValueSet/encounter-admit-source"
http://terminology.hl7.org/CodeSystem/audit-entity-type,1.0.1,active,"2.16.840.1.113883.4.642.1.1134",AuditEventEntityType,Audit event entity type,"Code for the entity type involved in the audit event.","ValueSet/audit-entity-type"
http://terminology.hl7.org/CodeSystem/audit-event-type,1.0.0,active,"2.16.840.1.113883.4.642.1.1136",AuditEventID,Audit Event ID,"Event Types for Audit Events - defined by DICOM with some FHIR specific additions.","ValueSet/audit-event-type"
http://terminology.hl7.org/CodeSystem/common-tags,1.0.1,active,"2.16.840.1.113883.4.642.1.1067",CommonTags,Common Tags,"Common Tag Codes defined by FHIR project","ValueSet/common-tags"
http://terminology.hl7.org/CodeSystem/communication-category,1.0.1,active,"2.16.840.1.113883.4.642.1.1076",CommunicationCategory,CommunicationCategory,"Codes for general categories of communications such as alerts, instructions, etc.","ValueSet/communication-category"
http://terminology.hl7.org/CodeSystem/communication-not-done-reason,1.0.1,active,"2.16.840.1.113883.4.642.1.1077",CommunicationNotDoneReason,CommunicationNotDoneReason,"Codes for the reason why a communication did not happen.","ValueSet/communication-not-done-reason"
http://terminology.hl7.org/CodeSystem/communication-topic,1.0.1,active,"2.16.840.1.113883.4.642.1.1078",CommunicationTopic,CommunicationTopic,"Codes describing the purpose or content of the communication.","ValueSet/communication-topic"
http://terminology.hl7.org/CodeSystem/condition-category,1.0.1,active,"2.16.840.1.113883.4.642.1.1073",ConditionCategoryCodes,Condition Category Codes,"Preferred value set for Condition Categories.","ValueSet/condition-category"
http://terminology.hl7.org/CodeSystem/condition-clinical,3.0.0,active,"2.16.840.1.113883.4.642.1.1074",ConditionClinicalStatusCodes,Condition Clinical Status Codes,"Preferred value set for Condition Clinical Status.","ValueSet/condition-clinical"
http://terminology.hl7.org/CodeSystem/condition-ver-status,2.0.1,active,"2.16.840.1.113883.4.642.1.1075",ConditionVerificationStatus,ConditionVerificationStatus,"The verification status to support or decline the clinical status of the condition or diagnosis.","ValueSet/condition-ver-status"
http://terminology.hl7.org/CodeSystem/contactentity-type,1.0.0,draft,"2.16.840.1.113883.4.642.1.1129",ContactEntityType,Contact entity type,"This example value set defines a set of codes that can be used to indicate the purpose for which you would contact a contact party.","ValueSet/contactentity-type"
http://terminology.hl7.org/CodeSystem/contractsignertypecodes,1.0.1,active,"2.16.840.1.113883.4.642.1.1201",ContractSignerTypeCodes,Contract Signer Type Codes,"This value set includes sample Contract Signer Type codes.","ValueSet/participation-role-type,ValueSet/security-role-type"
http://terminology.hl7.org/CodeSystem/coverage-class,1.0.1,active,"2.16.840.1.113883.4.642.1.1147",CoverageClassCodes,Coverage Class Codes,"This value set includes Coverage Class codes.","ValueSet/coverage-class"
http://terminology.hl7.org/CodeSystem/coverage-copay-type,1.0.1,active,"2.16.840.1.113883.4.642.1.1149",CoverageCopayTypeCodes,Coverage Copay Type Codes,"This value set includes sample Coverage Copayment Type codes.","ValueSet/coverage-copay-type"
http://terminology.hl7.org/CodeSystem/coverage-selfpay,1.0.1,active,"2.16.840.1.113883.4.642.1.1148",CoverageSelfPayCodes,Coverage SelfPay Codes,"This value set includes Coverage SelfPay codes.","ValueSet/coverage-type"
http://terminology.hl7.org/CodeSystem/diagnosis-role,1.1.1,active,"2.16.840.1.113883.4.642.1.1054",DiagnosisRole,Diagnosis Role,"This value set defines a set of codes that can be used to express the role of a diagnosis on the Encounter or EpisodeOfCare record.","ValueSet/diagnosis-role"
http://terminology.hl7.org/CodeSystem/dicom-audit-lifecycle,2.0.0,active,,DicomAuditMessageRecordLifecycleEvents,DICOM Audit Message Record Lifecycle Events,"Attached is vocabulary for the record lifecycle events, as per DICOM Audit Message, ","ValueSet/object-lifecycle-events"
http://terminology.hl7.org/CodeSystem/diet,1.0.1,active,"2.16.840.1.113883.4.642.1.1091",Diet,Diet,"This value set defines a set of codes that can be used to indicate dietary preferences or restrictions a patient may have.","ValueSet/encounter-diet"
http://terminology.hl7.org/CodeSystem/discharge-disposition,1.0.1,active,"2.16.840.1.113883.4.642.1.1093",DischargeDisposition,Discharge disposition,"This value set defines a set of codes that can be used to where the patient left the hospital.","ValueSet/encounter-discharge-disposition"
http://terminology.hl7.org/CodeSystem/dose-rate-type,1.0.0,draft,"2.16.840.1.113883.4.642.1.1069",DoseAndRateType,DoseAndRateType,"The kind of dose or rate specified.","ValueSet/dose-rate-type"
http://terminology.hl7.org/CodeSystem/encounter-special-arrangements,1.0.1,active,"2.16.840.1.113883.4.642.1.1090",SpecialArrangements,Special arrangements,"This value set defines a set of codes that can be used to indicate the kinds of special arrangements in place for a patients visit.","ValueSet/encounter-special-arrangements"
http://terminology.hl7.org/CodeSystem/encounter-type,1.0.1,active,"2.16.840.1.113883.4.642.1.1088",EncounterType,Encounter type,"This example value set defines a set of codes that can be used to indicate the type of encounter: a specific code indicating type of service provided.","ValueSet/encounter-type"
http://terminology.hl7.org/CodeSystem/ex-USCLS,1.0.0,draft,"2.16.840.1.113883.4.642.1.1153",USCLSCodes,USCLS Codes,"This value set includes a smattering of USCLS codes.","ValueSet/service-uscls"
http://terminology.hl7.org/CodeSystem/ex-benefitcategory,1.0.1,active,"2.16.840.1.113883.4.642.1.1175",BenefitCategoryCodes,Benefit Category Codes,"This value set includes examples of Benefit Category codes.","ValueSet/ex-benefitcategory"
http://terminology.hl7.org/CodeSystem/ex-coverage-financial-exception,1.0.1,active,"2.16.840.1.113883.4.642.1.1329",ExampleCoverageFinancialExceptionCodes,Example Coverage Financial Exception Codes,"This value set includes Example Coverage Financial Exception Codes.","ValueSet/coverage-financial-exception"
http://terminology.hl7.org/CodeSystem/extra-security-role-type,1.0.1,active,,SecurityRoleType,Security Role Type,"This CodeSystem contains Additional FHIR-defined Security Role types not defined elsewhere","ValueSet/participation-role-type,ValueSet/security-role-type"
http://terminology.hl7.org/CodeSystem/iso-21089-lifecycle,1.0.0,active,,Iso_21089_2017_Health_Record_Lifecycle_Events,ISO 21089 2017 Health Record Lifecycle Events,"Attached is vocabulary for the 27 record lifecycle events, as per ISO TS 21089-2017, Health Informatics - Trusted End-to-End Information Flows, Section 3, Terms and Definitions (2017, at ISO Central Secretariat, passed ballot and ready for publication).  This will also be included in the FHIR EHR Record Lifecycle Event Implementation Guide, balloted and (to be) published with FHIR STU-3.","ValueSet/audit-event-type,ValueSet/object-lifecycle-events"
http://terminology.hl7.org/CodeSystem/location-physical-type,2.0.1,active,"2.16.840.1.113883.4.642.1.1108",LocationType,Location type,"This example value set defines a set of codes that can be used to indicate the physical form of the Location.  This includes several 'non physical' codes which are still considered a location.","ValueSet/location-physical-type"
http://terminology.hl7.org/CodeSystem/medicationdispense-performer-function,1.0.1,active,"2.16.840.1.113883.4.642.1.1319",MedicationDispensePerformerFunctionCodes,MedicationDispense Performer Function Codes,"MedicationDispense Performer Function Codes","ValueSet/medicationdispense-performer-function"
http://terminology.hl7.org/CodeSystem/medicationdispense-status,4.0.1,draft,"2.16.840.1.113883.4.642.4.1313",MedicationDispense Status Codes,Medication dispense  status  codes,"MedicationDispense Status Codes","ValueSet/medicationdispense-status"
http://terminology.hl7.org/CodeSystem/medicationrequest-category,1.0.0,draft,"2.16.840.1.113883.4.642.1.1323",MedicationRequestCategoryCodes,MedicationRequest Category Codes,"MedicationRequest Category Codes","ValueSet/medicationrequest-category"
http://terminology.hl7.org/CodeSystem/medicationrequest-course-of-therapy,1.0.1,active,"2.16.840.1.113883.4.642.1.1327",MedicationRequestCourseOfTherapyCodes,MedicationRequest Course of Therapy Codes,"MedicationRequest Course of Therapy Codes","ValueSet/medicationrequest-course-of-therapy"
http://terminology.hl7.org/CodeSystem/medicationrequest-status-reason,1.0.1,active,"2.16.840.1.113883.4.642.1.1325",MedicationRequestStatusReasonCodes,MedicationRequest Status Reason Codes,"MedicationRequest Status Reason Codes","ValueSet/medicationrequest-status-reason"
http://terminology.hl7.org/CodeSystem/modifiers,1.0.1,active,"2.16.840.1.113883.4.642.1.1151",ModifierTypeCodes,Modifier type Codes,"This value set includes sample Modifier type codes.","ValueSet/claim-modifiers"
http://terminology.hl7.org/CodeSystem/object-role,1.1.0,active,"2.16.840.1.113883.4.642.1.1135",AuditEventEntityRole,AuditEventEntityRole,"Code representing the role the entity played in the audit event.","ValueSet/object-role"
http://terminology.hl7.org/CodeSystem/participant-type,1.0.1,active,"2.16.840.1.113883.4.642.1.1089",ParticipantType,Participant type,"This value set defines a set of codes that can be used to indicate how an individual participates in an encounter.","ValueSet/encounter-participant-type"
http://terminology.hl7.org/CodeSystem/practitioner-role,1.0.1,active,"2.16.840.1.113883.4.642.1.1132",PractitionerRole,Practitioner role,"This example value set defines a set of codes that can be used to indicate the role of a Practitioner.","ValueSet/practitioner-role"
http://terminology.hl7.org/CodeSystem/processpriority,1.0.1,active,"2.16.840.1.113883.4.642.1.1155",ProcessPriorityCodes,Process Priority Codes,"This value set includes the financial processing priority codes.","ValueSet/process-priority"
http://terminology.hl7.org/CodeSystem/provenance-participant-type,1.1.0,active,"2.16.840.1.113883.4.642.1.1131",ProvenanceParticipantType,Provenance participant type,"These codes define the type of participation by an agent in a provenance activity. An agent is something that bears the responsibility identified by the type of participation in the activity taking place, for the existence of an entity, or for another agent's activity. An Agent may be An agent, device, system, organization, group, care-team, or other identifiable thing.","ValueSet/provenance-agent-type"
http://terminology.hl7.org/CodeSystem/security-source-type,1.0.0,active,"2.16.840.1.113883.4.642.1.1137",AuditEventSourceType,Audit Event Source Type,"The type of process where the audit event originated from.","ValueSet/audit-source-type"
http://terminology.hl7.org/CodeSystem/service-type,1.1.1,active,"2.16.840.1.113883.4.642.1.1145",ServiceType,Service type,"This value set defines an example set of codes of service-types.","ValueSet/service-type"
http://terminology.hl7.org/CodeSystem/subscriber-relationship,1.0.1,active,"2.16.840.1.113883.4.642.1.1386",SubscriberRelationshipCodes,SubscriberPolicyholder Relationship Codes,"This value set includes codes for the relationship between the Subscriber and the Beneficiary (insured/covered party/patient).","ValueSet/subscriber-relationship"
http://terminology.hl7.org/CodeSystem/v2-0092,2.0.0,active,"2.16.840.1.113883.18.36",ReAdmissionIndicator,re-admissionIndicator,"Code system of concepts which are used to specify that a patient is being re admitted to a healthcare facilityin from which they were discharged, and indicates the circumstances around such re-admission.  Used in HL7 Version 2.x messagine in the PV1 segment.","ValueSet/v2-0092"
http://terminology.hl7.org/CodeSystem/v2-0116,2.0.0,active,"2.16.840.1.113883.18.47",BedStatus,bedStatus,"Code system of concepts which specify the state of a bed in an inpatient setting, and is used to determine if a patient may be assigned to it or not.  Used in HL7 Version 2.x messaging in the DLD and PV1 segments.","ValueSet/v2-0116"
http://terminology.hl7.org/CodeSystem/v2-0131,2.0.0,active,"2.16.840.1.113883.18.58",ContactRole2,contactRole2,"Code system of concepts which specify a relationship role that the next of kin/associated parties plays with regard to the patient. Also used in referrals, for example, it may be necessary to identify the contact representative at the clinic that sent a referral. Used in HL7 Version 2 messaging in the NK1 and CTD segments after 2.5, when it replace 2.16.840.1.113883.18.57.","ValueSet/patient-contactrelationship"
http://terminology.hl7.org/CodeSystem/v2-0203,5.0.0,active,"2.16.840.1.113883.18.108",IdentifierType,identifierType,"HL7-defined code system of concepts specifying type of identifier. Used in HL7 Version 2.x messaging data types CX, PLN, PPN, XCN and XON.","ValueSet/identifier-type"
http://terminology.hl7.org/CodeSystem/v3-ActCode,9.0.0,active,"2.16.840.1.113883.5.4",ActCode,ActCode,"A code specifying the particular kind of Act that the Act-instance represents within its class.    *Constraints:* The kind of Act (e.g. physical examination, serum potassium, inpatient encounter, charge financial transaction, etc.) is specified with a code from one of several, typically external, coding systems. The coding system will depend on the class of Act, such as LOINC for observations, etc.    Conceptually, the Act.code must be a specialization of the Act.classCode. This is why the structure of ActClass domain should be reflected in the superstructure of the ActCode domain and then individual codes or externally referenced vocabularies subordinated under these domains that reflect the ActClass structure.    Act.classCode and Act.code are not modifiers of each other but the Act.code concept should really imply the Act.classCode concept. For a negative example, it is not appropriate to use an Act.code ""potassium"" together with and Act.classCode for ""laboratory observation"" to somehow mean ""potassium laboratory observation"" and then use the same Act.code for ""potassium"" together with Act.classCode for ""medication"" to mean ""substitution of potassium"". This mutually modifying use of Act.code and Act.classCode is not permitted.","ValueSet/v3-ActPharmacySupplyType,ValueSet/v3-ActCode,ValueSet/provenance-activity-type,ValueSet/v3-ActEncounterCode"
http://terminology.hl7.org/CodeSystem/v3-ActPriority,3.0.0,active,"2.16.840.1.113883.5.7",ActPriority,ActPriority,"A set of codes (e.g., for routine, emergency), specifying the urgency under which the Act happened, can happen, is happening, is intended to happen, or is requested/demanded to happen.","ValueSet/v3-ActPriority"
http://terminology.hl7.org/CodeSystem/v3-ActReason,3.1.0,active,"2.16.840.1.113883.5.8",ActReason,ActReason,"A set of codes specifying the motivation, cause, or rationale of an Act, when such rationale is not reasonably represented as an ActRelationship of type ""has reason"" linking to another Act.    *Examples:* Example reasons that might qualify for being coded in this field might be: ""routine requirement"", ""infectious disease reporting requirement"", ""on patient request"", ""required by law"".","ValueSet/v3-PurposeOfUse,ValueSet/v3-SubstanceAdminSubstitutionReason"
http://terminology.hl7.org/CodeSystem/v3-DataOperation,5.0.0,active,"2.16.840.1.113883.5.1123",DataOperation,DataOperation,"**** MISSING DESCRIPTION ****","ValueSet/provenance-activity-type"
