URL,Version,Status,OIDs,Name,Title,Description,Used
http://terminology.hl7.org/CodeSystem/v3-DocumentCompletion,3.0.0,active,"2.16.840.1.113883.5.33",DocumentCompletion,DocumentCompletion,"Identifies the current completion state of a clinical document.","ValueSet/provenance-activity-type"
http://terminology.hl7.org/CodeSystem/v3-EncounterSpecialCourtesy,3.0.0,active,"2.16.840.1.113883.5.40",EncounterSpecialCourtesy,EncounterSpecialCourtesy,"**** MISSING DESCRIPTION ****","ValueSet/encounter-special-courtesy"
http://terminology.hl7.org/CodeSystem/v3-MaritalStatus,3.0.0,active,"2.16.840.1.113883.5.2",MaritalStatus,MaritalStatus,"\* \* \* No description supplied \* \* \*    *Open Issue:* The specific meanings of these codes can vary somewhat by jurisdiction and implementation so caution should be used when determining equivalency.    *Open Issue:* fixing and completion of the hierarchy and proper good definitions of all the concepts is badly needed.","ValueSet/marital-status"
http://terminology.hl7.org/CodeSystem/v3-NullFlavor,3.0.0,active,"2.16.840.1.113883.5.1008",NullFlavor,NullFlavor,"A collection of codes specifying why a valid value is not present.","ValueSet/marital-status,ValueSet/encounter-special-courtesy"
http://terminology.hl7.org/CodeSystem/v3-ParticipationFunction,3.0.0,active,"2.16.840.1.113883.5.88",ParticipationFunction,ParticipationFunction,"This code is used to specify the exact function an actor had in a service in all necessary detail. This domain may include local extensions (CWE).","ValueSet/participation-role-type,ValueSet/security-role-type"
http://terminology.hl7.org/CodeSystem/v3-ParticipationMode,4.0.0,active,"2.16.840.1.113883.5.1064",ParticipationMode,ParticipationMode,"A set of codes specifying the modality by which the Entity playing the Role is participating in the Act.    *Examples:* Physically present, over the telephone, written communication.    *Rationale:* Particularly for author (originator) participants this is used to specify whether the information represented by the act was initially provided verbally, (hand-)written, or electronically.    *Open Issue:* There needs to be a reexamination of the hierarchies as there seems to be some muddling between ELECTRONIC and other concepts that involve electronic communication that are in other hierarchies.","ValueSet/v3-ParticipationMode"
http://terminology.hl7.org/CodeSystem/v3-ParticipationType,5.0.0,active,"2.16.840.1.113883.5.90",ParticipationType,ParticipationType,"A code specifying the meaning and purpose of every Participation instance. Each of its values implies specific constraints on the Roles undertaking the participation.","ValueSet/participation-role-type,ValueSet/security-role-type,ValueSet/encounter-participant-type,ValueSet/provenance-activity-type"
http://terminology.hl7.org/CodeSystem/v3-RoleClass,4.0.0,active,"2.16.840.1.113883.5.110",RoleClass,RoleClass,"Codes for the Role class hierarchy. The values in this hierarchy, represent a Role which is an association or relationship between two entities - the entity that plays the role and the entity that scopes the role. Roles names are derived from the name of the playing entity in that role.    The role hierarchy stems from three core concepts, or abstract domains:     *  **RoleClassOntological** is an abstract domain that collects roles in which the playing entity is defined or specified by the scoping entity.   *  **RoleClassPartitive** collects roles in which the playing entity is in some sense a ""part"" of the scoping entity.   *  **RoleClassAssociative** collects all of the remaining forms of association between the playing entity and the scoping entity. This set of roles is further partitioned between:             *  **RoleClassPassive** which are roles in which the playing entity is used, known, treated, handled, built, or destroyed, etc. under the auspices of the scoping entity. The playing entity is passive in these roles in that the role exists without an agreement from the playing entity.       *  **RoleClassMutualRelationship** which are relationships based on mutual behavior of the two entities. The basis of these relationship may be formal agreements or they may be *de facto* behavior. Thus, this sub-domain is further divided into:                     *  **RoleClassRelationshipFormal** in which the relationship is formally defined, frequently by a contract or agreement.           *  **Personal relationship** which inks two people in a personal relationship.    The hierarchy discussed above is represented In the current vocabulary tables as a set of abstract domains, with the exception of the ""Personal relationship"" which is a leaf concept.    *OpenIssue:* Description copied from Concept Domain of same name. Must be verified.","ValueSet/participation-role-type,ValueSet/security-role-type"
http://terminology.hl7.org/CodeSystem/v3-RoleCode,3.0.0,active,"2.16.840.1.113883.5.111",RoleCode,RoleCode,"A set of codes further specifying the kind of Role; specific classification codes for further qualifying RoleClass codes.","ValueSet/participation-role-type,ValueSet/security-role-type,ValueSet/v3-ServiceDeliveryLocationRoleType"
http://terminology.hl7.org/CodeSystem/v3-substanceAdminSubstitution,3.0.0,active,"2.16.840.1.113883.5.1070",SubstanceAdminSubstitution,Substance Admin Substitution,"Identifies what sort of change is permitted or has occurred between the therapy that was ordered and the therapy that was/will be provided.","ValueSet/v3-ActSubstanceAdminSubstitutionCode"
http://terminology.hl7.org/fhir/CodeSystem/medicationdispense-category,4.0.1,draft,"2.16.840.1.113883.4.642.4.1315",MedicationDispense Category Codes,Medication dispense  category  codes,"MedicationDispense Category Codes","ValueSet/medicationdispense-category"
http://terminology.hl7.org/fhir/CodeSystem/medicationdispense-status-reason,4.0.1,draft,"2.16.840.1.113883.4.642.4.1317",MedicationDispense Status Reason Codes,Medication dispense  status  reason  codes,"MedicationDispense Status Codes","ValueSet/medicationdispense-status-reason"
https://pcn.gov.ng/CodeSystem/nigeria-facility-type,0.1.0,active,,NGFacilityTypeCS,NG-Imm Facility Type CS,"A standardized classification system used to describe the type or level of health facility within a healthcare delivery system, based on the scope of services provided, staffing, infrastructure, and administrative role.","ValueSet/nigeria-facility-types"
https://pcn.gov.ng/CodeSystem/nigeria-gender,0.1.0,active,,NGGenderCS,NG-Imm Gender CS,"The administrative gender of a person.","ValueSet/nigeria-gender"
https://pcn.gov.ng/CodeSystem/nigeria-languages,0.1.0,active,,NGLanguagesCS,NG‑Imm Languages in Nigeria CS,"This CodeSystem defines codes for major languages spoken across Nigeria.","ValueSet/nigeria-languages"
https://pcn.gov.ng/CodeSystem/nigeria-lgas,0.1.0,active,,NGLGAsCS,NG-Imm LGAs in Nigeria CS,"This CodeSystem defines LGA codes and names mapped to their respective States in Nigeria.","ValueSet/nigeria-lgas"
https://pcn.gov.ng/CodeSystem/nigeria-location-owner-cs,0.1.0,draft,,NGOrganizationOwnerCS,NG-Imm Location Owner CS,"This CodeSystem defines Immunization Location Owner.","ValueSet/nigeria-location-owner"
https://pcn.gov.ng/CodeSystem/nigeria-states,0.1.0,active,,NGStatesCS,NG-Imm States in Nigeria CS,"This CodeSystem defines ward codes and names mapped to their respective States in Nigeria.","ValueSet/nigeria-states"
https://pcn.gov.ng/CodeSystem/nigeria-wards,0.1.0,active,,NGWardsCS,NG-Imm Administrative Wards CS,"This CodeSystem defines ward codes and names mapped to their respective Local Government Areas (LGAs) in Nigeria.","ValueSet/nigeria-wards"
urn:ietf:bcp:47,2.0.1,active,"2.16.840.1.113883.6.121",Ietf3066,Tags for the Identification of Languages,"Older value from OID registry.  Superceded; see recommendations in BCP-47.","ValueSet/languages"
